{
  "schema_version": "1.0.0",
  "feature_id": "claims-ledger-and-normative-boundaries",
  "validation_id": "VAL-READY-017",
  "version": "1.0.0",
  "sources": [
    {
      "id": "NORM-RFC-0003",
      "rfc_id": "RFC-0003",
      "path": "docs/rfcs/0003-raw-capture.md",
      "title": "Raw capture",
      "version": "0.1.0",
      "status": "proposed",
      "sha256": "13134baa67ec1dedc26d71b94845c542e75d40f23c804d2bda5cbc8a67713428",
      "normative_sections": ["Normative contract"],
      "informative_sections": ["Summary", "Motivation", "Scope and non-goals", "Informative rationale", "Alternatives", "Validation"],
      "rendered_status": "Normative draft, proposed, version 0.1.0",
      "eligible_for_certification": false,
      "supersession": {"supersedes": null, "superseded_by": null}
    },
    {
      "id": "NORM-RFC-0004",
      "rfc_id": "RFC-0004",
      "path": "docs/rfcs/0004-evidence-graph.md",
      "title": "Provenance-preserving evidence graph",
      "version": "0.1.0",
      "status": "proposed",
      "sha256": "03d8380e5ba8fa9cfabfad6e7539b68f112ae961f6db9feef42c374206bcbad2",
      "normative_sections": ["Normative contract"],
      "informative_sections": ["Summary", "Motivation", "Scope and non-goals", "Informative rationale", "Alternatives", "Validation"],
      "rendered_status": "Normative draft, proposed, version 0.1.0",
      "eligible_for_certification": false,
      "supersession": {"supersedes": null, "superseded_by": null}
    },
    {
      "id": "NORM-RFC-0005",
      "rfc_id": "RFC-0005",
      "path": "docs/rfcs/0005-artifacts.md",
      "title": "Artifacts",
      "version": "0.1.0",
      "status": "proposed",
      "sha256": "244b8151c60a85c586cd87dd4ee709799141b014f72e868ddafa24a50435b2ab",
      "normative_sections": ["Normative contract"],
      "informative_sections": ["Summary", "Motivation", "Scope and non-goals", "Informative rationale", "Alternatives", "Validation"],
      "rendered_status": "Normative draft, proposed, version 0.1.0",
      "eligible_for_certification": false,
      "supersession": {"supersedes": null, "superseded_by": null}
    },
    {
      "id": "NORM-RFC-0006",
      "rfc_id": "RFC-0006",
      "path": "docs/rfcs/0006-findings.md",
      "title": "Findings",
      "version": "0.1.0",
      "status": "proposed",
      "sha256": "87ab20a5d6b27cc3549385564c8c3820c77a8aebe612fefb681c5d764690b8b9",
      "normative_sections": ["Normative contract"],
      "informative_sections": ["Summary", "Motivation", "Scope and non-goals", "Informative rationale", "Alternatives", "Validation"],
      "rendered_status": "Normative draft, proposed, version 0.1.0",
      "eligible_for_certification": false,
      "supersession": {"supersedes": null, "superseded_by": null}
    },
    {
      "id": "NORM-RFC-0007",
      "rfc_id": "RFC-0007",
      "path": "docs/rfcs/0007-analyzer-runs.md",
      "title": "Analyzer runs",
      "version": "0.1.0",
      "status": "proposed",
      "sha256": "6d9f976f86a48b564d81bcbd9d7bf85aeee657861d712e623e97e475ac228018",
      "normative_sections": ["Normative contract"],
      "informative_sections": ["Summary", "Motivation", "Scope and non-goals", "Informative rationale", "Alternatives", "Validation"],
      "rendered_status": "Normative draft, proposed, version 0.1.0",
      "eligible_for_certification": false,
      "supersession": {"supersedes": null, "superseded_by": null}
    },
    {
      "id": "NORM-RFC-0008",
      "rfc_id": "RFC-0008",
      "path": "docs/rfcs/0008-enforcement-hooks.md",
      "title": "Enforcement hooks",
      "version": "0.1.0",
      "status": "proposed",
      "sha256": "469e7fe8f91b88f45c6e1d45259e5bda3d699bb04da00a68076a97dc751fff87",
      "normative_sections": ["Normative contract"],
      "informative_sections": ["Summary", "Motivation", "Scope and non-goals", "Informative rationale", "Alternatives", "Validation"],
      "rendered_status": "Normative draft, proposed, version 0.1.0",
      "eligible_for_certification": false,
      "supersession": {"supersedes": null, "superseded_by": null}
    },
    {
      "id": "NORM-RFC-0009",
      "rfc_id": "RFC-0009",
      "path": "docs/rfcs/0009-policy-decisions.md",
      "title": "Policy decisions",
      "version": "0.1.0",
      "status": "proposed",
      "sha256": "3ca9941882b54c2ef61849f39e9b779128b18e71378a25495dd0057c5684f9ae",
      "normative_sections": ["Normative contract"],
      "informative_sections": ["Summary", "Motivation", "Scope and non-goals", "Informative rationale", "Alternatives", "Validation"],
      "rendered_status": "Normative draft, proposed, version 0.1.0",
      "eligible_for_certification": false,
      "supersession": {"supersedes": null, "superseded_by": null}
    },
    {
      "id": "NORM-RFC-0010",
      "rfc_id": "RFC-0010",
      "path": "docs/rfcs/0010-signed-receipts.md",
      "title": "Signed decision receipts",
      "version": "0.1.0",
      "status": "proposed",
      "sha256": "9174d25f1a770def27f9b46af8d8bfdb28d8b2a674333e4a80f85ccb5d532d58",
      "normative_sections": ["Normative contract"],
      "informative_sections": ["Summary", "Motivation", "Scope and non-goals", "Informative rationale", "Alternatives", "Validation"],
      "rendered_status": "Normative draft, proposed, version 0.1.0",
      "eligible_for_certification": false,
      "supersession": {"supersedes": null, "superseded_by": null}
    },
    {
      "id": "NORM-RFC-0011",
      "rfc_id": "RFC-0011",
      "path": "docs/rfcs/0011-audit-checkpoints.md",
      "title": "Audit chains and signed checkpoints",
      "version": "0.1.0",
      "status": "proposed",
      "sha256": "87aa20df2f555b2df2fb0eeb4c783e956bb20c6909db71849c8c2073746d68e8",
      "normative_sections": ["Normative contract"],
      "informative_sections": ["Summary", "Motivation", "Scope and non-goals", "Informative rationale", "Alternatives", "Validation"],
      "rendered_status": "Normative draft, proposed, version 0.1.0",
      "eligible_for_certification": false,
      "supersession": {"supersedes": null, "superseded_by": null}
    },
    {
      "id": "NORM-RFC-0012",
      "rfc_id": "RFC-0012",
      "path": "docs/rfcs/0012-extension-namespaces.md",
      "title": "Extension namespaces",
      "version": "0.1.0",
      "status": "proposed",
      "sha256": "f349f2e61e753182fc1bcc1315e7f068d571a04e0161b61047c1e5f5d553ab48",
      "normative_sections": ["Normative contract"],
      "informative_sections": ["Summary", "Motivation", "Scope and non-goals", "Informative rationale", "Alternatives", "Validation"],
      "rendered_status": "Normative draft, proposed, version 0.1.0",
      "eligible_for_certification": false,
      "supersession": {"supersedes": null, "superseded_by": null}
    },
    {
      "id": "NORM-RFC-0013",
      "rfc_id": "RFC-0013",
      "path": "docs/rfcs/0013-versioning.md",
      "title": "Protocol and schema versioning",
      "version": "0.1.0",
      "status": "proposed",
      "sha256": "f8a33db4cf908c97e252912d5f28815c6f68c6c1334ea5a95bbb64bd7a337074",
      "normative_sections": ["Normative contract"],
      "informative_sections": ["Summary", "Motivation", "Scope and non-goals", "Informative rationale", "Alternatives", "Validation"],
      "rendered_status": "Normative draft, proposed, version 0.1.0",
      "eligible_for_certification": false,
      "supersession": {"supersedes": null, "superseded_by": null}
    },
    {
      "id": "NORM-RFC-0014",
      "rfc_id": "RFC-0014",
      "path": "docs/rfcs/0014-conformance-profiles.md",
      "title": "Conformance profiles",
      "version": "0.1.0",
      "status": "proposed",
      "sha256": "e31e3580806728bd94c53f252d5276ea8f7dc2046557d9457182a5bc51e80aeb",
      "normative_sections": ["Normative contract"],
      "informative_sections": ["Summary", "Motivation", "Scope and non-goals", "Informative rationale", "Alternatives", "Validation"],
      "rendered_status": "Normative draft, proposed, version 0.1.0",
      "eligible_for_certification": false,
      "supersession": {"supersedes": null, "superseded_by": null}
    }
  ],
  "conformance_inputs": [
    {"id": "CONF-RFC-0003", "source_id": "NORM-RFC-0003", "path": "docs/rfcs/0003-raw-capture.md", "section": "Normative contract", "version": "0.1.0", "rendered_status": "Draft conformance input; not certification-eligible"},
    {"id": "CONF-RFC-0004", "source_id": "NORM-RFC-0004", "path": "docs/rfcs/0004-evidence-graph.md", "section": "Normative contract", "version": "0.1.0", "rendered_status": "Draft conformance input; not certification-eligible"},
    {"id": "CONF-RFC-0005", "source_id": "NORM-RFC-0005", "path": "docs/rfcs/0005-artifacts.md", "section": "Normative contract", "version": "0.1.0", "rendered_status": "Draft conformance input; not certification-eligible"},
    {"id": "CONF-RFC-0006", "source_id": "NORM-RFC-0006", "path": "docs/rfcs/0006-findings.md", "section": "Normative contract", "version": "0.1.0", "rendered_status": "Draft conformance input; not certification-eligible"},
    {"id": "CONF-RFC-0007", "source_id": "NORM-RFC-0007", "path": "docs/rfcs/0007-analyzer-runs.md", "section": "Normative contract", "version": "0.1.0", "rendered_status": "Draft conformance input; not certification-eligible"},
    {"id": "CONF-RFC-0008", "source_id": "NORM-RFC-0008", "path": "docs/rfcs/0008-enforcement-hooks.md", "section": "Normative contract", "version": "0.1.0", "rendered_status": "Draft conformance input; not certification-eligible"},
    {"id": "CONF-RFC-0009", "source_id": "NORM-RFC-0009", "path": "docs/rfcs/0009-policy-decisions.md", "section": "Normative contract", "version": "0.1.0", "rendered_status": "Draft conformance input; not certification-eligible"},
    {"id": "CONF-RFC-0010", "source_id": "NORM-RFC-0010", "path": "docs/rfcs/0010-signed-receipts.md", "section": "Normative contract", "version": "0.1.0", "rendered_status": "Draft conformance input; not certification-eligible"},